<dataset xmlns:xsi="http://www.w3.org/2001/XMLSchema-instance"
         xsi:noNamespaceSchemaLocation="molSchema.xsd">

    <addresses id="1ae4ec9b-286d-4506-b915-b5b9527284e0"
               number="1"
               street="localWithoutOwnerStreet"
               city="localWithoutOwnerCity"
               zip="123-12"
               country="localWithoutOwnerCountry"
               version="0"
               created_at="2024-05-04 14:33:01.413581"
               modified_at="2024-05-04 14:33:01.413581"
               created_by="[NULL]"
               modified_by="[NULL]"/>
    
    <locals id="64d715a3-0dd5-4520-9716-965db9ce1ac5"
            name="localWithoutOwner"
            description="localWithoutOwner"
            size="2"
            state="4"
            address_id="1ae4ec9b-286d-4506-b915-b5b9527284e0"
            margin_fee="50"
            rental_fee="50"
            version="1"
            created_at="2024-05-04 14:33:01.413581"
            modified_at="2024-05-04 14:33:01.413581"
            created_by="[NULL]"
            modified_by="[NULL]"/>

    <addresses id="1ae4ec9b-286d-4506-b915-b5b9527284e9"
               number="1"
               street="inactiveLocalStreet"
               city="inactiveLocalCity"
               zip="12-312"
               country="inactiveLocalCountry"
               version="0"
               created_at="2024-05-04 14:33:01.413581"
               modified_at="2024-05-04 14:33:01.413581"
               created_by="[NULL]"
               modified_by="[NULL]"/>

    <locals id="64d715a3-0dd5-4520-9716-965db9ce1ac6"
            name="local"
            description="inactiveLocal"
            size="2"
            state="3"
            address_id="1ae4ec9b-286d-4506-b915-b5b9527284e9"
            margin_fee="50"
            rental_fee="50"
            version="1"
            created_at="2024-05-04 14:33:01.413581"
            modified_at="2024-05-04 14:33:01.413581"
            created_by="[NULL]"
            modified_by="[NULL]"/>
    
    <addresses id="065cee24-bbc4-4b45-89c9-48852207d14c"
               number="1"
               street="archivedLocalStreet"
               city="archivedLocalCity"
               zip="12-123"
               country="archivedLocalCountry" 
               version="1"
               created_at="2024-05-04 14:33:01.413581"
               modified_at="2024-05-04 14:33:01.413581" />
    
    <locals id="ff345812-b51c-4518-9c3f-8b0742392170"
            name="archivedLocal"
            description="archivedLocal"
            size="2"
            state="1"
            address_id="065cee24-bbc4-4b45-89c9-48852207d14c"
            margin_fee="10"
            rental_fee="14"
            version="1"
            created_at="2024-05-04 14:33:01.413581"
            modified_at="2024-05-04 14:33:01.413581" />

    <addresses id="ce8bb9fb-e7dd-4516-91d1-ef7ab09b9e57"
               number="1"
               street="unapprovedLocalStreet"
               city="unapprovedLocalCity"
               zip="12-123"
               country="unapprovedLocalCountry"
               version="1"
               created_at="2024-05-04 14:33:01.413581"
               modified_at="2024-05-04 14:33:01.413581" />

    <locals id="ec15320f-1dfc-495b-b2cf-2964c0b7ccd9"
            name="unapprovedLocal"
            description="unapprovedLocal"
            size="2"
            state="0"
            address_id="ce8bb9fb-e7dd-4516-91d1-ef7ab09b9e57"
            margin_fee="10"
            rental_fee="14"
            version="1"
            created_at="2024-05-04 14:33:01.413581"
            modified_at="2024-05-04 14:33:01.413581" />
</dataset>