<?xml version="1.0" encoding="UTF-8"?>
<dataset xmlns:xsi="http://www.w3.org/2001/XMLSchema-instance"
         xsi:noNamespaceSchemaLocation="molSchema.xsd">

    <!-- address1 -->
    <addresses id="1ae4ec9b-286d-4506-b915-b5b9527284e0"
               number="1"
               street="inactiveLocalStreet"
               city="inactiveLocalCity"
               zip="123-12"
               country="inactiveLocalCountry"
               version="0"
               created_at="2024-05-04 14:33:01.413581"
               modified_at="2024-05-04 14:33:01.413581"
               created_by="[NULL]"
               modified_by="[NULL]"/>

    <!-- address2 -->
    <addresses id="947ce115-d492-4508-b432-8a5711bad5d4"
               number="1"
               street="rentedLocalStreet"
               city="rentedLocalCity"
               zip="123-12"
               country="rentedLocalCountry"
               version="0"
               created_at="2024-05-04 14:33:01.413581"
               modified_at="2024-05-04 14:33:01.413581"
               created_by="[NULL]"
               modified_by="[NULL]"/>

    <!-- address3 -->
    <addresses id="a7717971-96e7-4dfc-b149-c1552b858f34"
               number="1"
               street="aleadres"
               city="afterRentLocalCity"
               zip="123-12"
               country="afterRentLocalCountry"
               version="0"
               created_at="2024-05-04 14:33:01.413581"
               modified_at="2024-05-04 14:33:01.413581"
               created_by="[NULL]"
               modified_by="[NULL]"/>

    <!-- active local 1 -->
    <locals id="7436607c-5928-489e-adba-511541df1b8d"
            name="activeLocal1"
            description="description1"
            size="100"
            state="2"
            address_id="a7717971-96e7-4dfc-b149-c1552b858f34"
            owner_id="d1130c9a-3bbb-4927-b79f-0fd521fa55ea"
            margin_fee="100"
            rental_fee="1000"
            version="0"
            created_at="2024-05-04 14:33:01.413581"
            modified_at="2024-05-04 14:33:01.413581"
            created_by="[NULL]"
            modified_by="[NULL]"/>

    <!-- address3 -->
    <addresses id="5a5f9400-9340-42e6-9914-a97ca03409d9"
               number="1"
               street="afterRentLocalStreet"
               city="afterRentLocalCity"
               zip="123-12"
               country="afterRentLocalCountry"
               version="0"
               created_at="2024-05-04 14:33:01.413581"
               modified_at="2024-05-04 14:33:01.413581"
               created_by="[NULL]"
               modified_by="[NULL]"/>

    <!-- active local 1 -->
    <locals id="3db8f4a7-a268-41a8-84f8-5e1a1dc4b4d0"
            name="activeLocal1"
            description="description1"
            size="100"
            state="2"
            address_id="1ae4ec9b-286d-4506-b915-b5b9527284e0"
            owner_id="d1130c9a-3bbb-4927-b79f-0fd521fa55ea"
            margin_fee="100"
            rental_fee="1000"
            version="0"
            created_at="2024-05-04 14:33:01.413581"
            modified_at="2024-05-04 14:33:01.413581"
            created_by="[NULL]"
            modified_by="[NULL]"/>

    <!-- active local 2 -->
    <locals id="a51f1e3e-e0e6-4a7d-80e5-16e245554c77"
            name="activeLocal2"
            description="description2"
            size="100"
            state="2"
            address_id="947ce115-d492-4508-b432-8a5711bad5d4"
            owner_id="d1130c9a-3bbb-4927-b79f-0fd521fa55ea"
            margin_fee="100"
            rental_fee="1000"
            version="0"
            created_at="2024-05-04 14:33:01.413581"
            modified_at="2024-05-04 14:33:01.413581"
            created_by="[NULL]"
            modified_by="[NULL]"/>

    <!-- inactive local 1 -->
    <locals id="222a7a48-3370-4fde-93b7-b3191671cdb3"
            name="inactive1"
            description="description3"
            size="100"
            state="3"
            address_id="5a5f9400-9340-42e6-9914-a97ca03409d9"
            owner_id="d1130c9a-3bbb-4927-b79f-0fd521fa55ea"
            margin_fee="100"
            rental_fee="1000"
            version="0"
            created_at="2024-05-04 14:33:01.413581"
            modified_at="2024-05-04 14:33:01.413581"
            created_by="[NULL]"
            modified_by="[NULL]"/>

    <!-- application for local active 2 and tenantMeTenant -->
    <applications id="6bc94516-c901-4ac1-8627-bffe4232c0d3" created_at="2024-05-04 14:33:01.413581"
                  modified_at="2024-05-04 14:33:01.413581"
                  version="1"
                  local_id="a51f1e3e-e0e6-4a7d-80e5-16e245554c77"
                  tenant_id="23aeee47-6b75-4de3-8313-5fccd3de841f"/>

</dataset>