<dataset xmlns:xsi="http://www.w3.org/2001/XMLSchema-instance"
         xsi:noNamespaceSchemaLocation="molSchema.xsd">


    <addresses id="1ae4ec9b-286d-4506-b915-b5b9527284e0"
               number="1"
               street="inactiveLocalStreet"
               city="inactiveLocalCity"
               zip="123-12"
               country="inactiveLocalCountry"
               version="0"
               created_at="2024-05-04 14:33:01.413581"
               modified_at="2024-05-04 14:33:01.413581"
               created_by="[NULL]"
               modified_by="[NULL]"/>

    <addresses id="947ce115-d492-4508-b432-8a5711bad5d4"
               number="1"
               street="rentedLocalStreet"
               city="rentedLocalCity"
               zip="123-12"
               country="rentedLocalCountry"
               version="0"
               created_at="2024-05-04 14:33:01.413581"
               modified_at="2024-05-04 14:33:01.413581"
               created_by="[NULL]"
               modified_by="[NULL]"/>

    <addresses id="5a5f9400-9340-42e6-9914-a97ca03409d9"
               number="1"
               street="afterRentLocalStreet"
               city="afterRentLocalCity"
               zip="123-12"
               country="afterRentLocalCountry"
               version="0"
               created_at="2024-05-04 14:33:01.413581"
               modified_at="2024-05-04 14:33:01.413581"
               created_by="[NULL]"
               modified_by="[NULL]"/>

    <addresses id="47c6513b-9619-4430-979f-978f165481db"
               number="12"
               street="afterRentLocalStreet1"
               city="afterRentLocalCit1y"
               zip="123-13"
               country="afterRentLocalCountry1"
               version="0"
               created_at="2024-05-04 14:33:01.413581"
               modified_at="2024-05-04 14:33:01.413581"
               created_by="[NULL]"
               modified_by="[NULL]"/>


    <locals id="3db8f4a7-a268-41a8-84f8-5e1a1dc4b4d0"
            name="inactiveLocal"
            description="mol8local description"
            size="100"
            state="3"
            address_id="1ae4ec9b-286d-4506-b915-b5b9527284e0"
            owner_id="d1130c9a-3bbb-4927-b79f-0fd521fa55ea"
            margin_fee="100"
            rental_fee="1000"
            version="0"
            created_at="2024-05-04 14:33:01.413581"
            modified_at="2024-05-04 14:33:01.413581"
            created_by="[NULL]"
            modified_by="[NULL]"/>

    <locals id="a51f1e3e-e0e6-4a7d-80e5-16e245554c77"
            name="rentedLocal"
            description="mol8local description"
            size="100"
            state="5"
            address_id="947ce115-d492-4508-b432-8a5711bad5d4"
            owner_id="d1130c9a-3bbb-4927-b79f-0fd521fa55ea"
            margin_fee="100"
            rental_fee="1000"
            version="0"
            created_at="2024-05-04 14:33:01.413581"
            modified_at="2024-05-04 14:33:01.413581"
            created_by="[NULL]"
            modified_by="[NULL]"/>

    <locals id="222a7a48-3370-4fde-93b7-b3191671cdb3"
            name="inactiveLocalAfterRent"
            description="mol8local description"
            size="100"
            state="3"
            address_id="5a5f9400-9340-42e6-9914-a97ca03409d9"
            owner_id="d1130c9a-3bbb-4927-b79f-0fd521fa55ea"
            margin_fee="100"
            rental_fee="1000"
            version="0"
            created_at="2024-05-04 14:33:01.413581"
            modified_at="2024-05-04 14:33:01.413581"
            created_by="[NULL]"
            modified_by="[NULL]"/>

    <locals id="47c6513b-9619-4430-979f-978f165481db"
            name="inactiveLocalAfterRent"
            description="mol8local description"
            size="100"
            state="3"
            address_id="5a5f9400-9340-42e6-9914-a97ca03409d9"
            owner_id="d1130c9a-3bbb-4927-b79f-0fd521fa55ea"
            margin_fee="100"
            rental_fee="1000"
            version="0"
            created_at="2024-05-04 14:33:01.413581"
            modified_at="2024-05-04 14:33:01.413581"
            created_by="[NULL]"
            modified_by="[NULL]"/>

    <rents id="31658859-f2dc-425a-bb98-8f444960bb35"
           balance="1000"
           local_id="222a7a48-3370-4fde-93b7-b3191671cdb3"
           owner_id="d1130c9a-3bbb-4927-b79f-0fd521fa55ea"
           tenant_id="673a4bf2-e274-4185-89c6-f67891a3cbe0"
           version="0"
           start_date="2024-01-20"
           end_date="2024-05-05"
           created_at="2024-05-04 14:33:01.413581"
           modified_at="2024-05-04 14:33:01.413581"
           created_by="[NULL]"
           modified_by="[NULL]"/>


    <rents id="5571842e-ec61-4a03-8715-36ccf3c5aa35"
           balance="1000"
           local_id="a51f1e3e-e0e6-4a7d-80e5-16e245554c77"
           owner_id="d1130c9a-3bbb-4927-b79f-0fd521fa55ea"
           tenant_id="673a4bf2-e274-4185-89c6-f67891a3cbe0"
           version="0"
           start_date="2024-01-20"
           end_date="2024-09-01"
           created_at="2024-05-04 14:33:01.413581"
           modified_at="2024-05-04 14:33:01.413581"
           created_by="[NULL]"
           modified_by="[NULL]"/>

    <rents id="2fde7510-8d4c-49cd-aa1d-5d848b510e23"
           balance="1000"
           local_id="47c6513b-9619-4430-979f-978f165481db"
           owner_id="d1130c9a-3bbb-4927-b79f-0fd521fa55ea"
           tenant_id="673a4bf2-e274-4185-89c6-f67891a3cbe0"
           version="0"
           start_date="2024-01-20"
           end_date="2024-09-01"
           created_at="2024-05-04 14:33:01.413581"
           modified_at="2024-05-04 14:33:01.413581"
           created_by="[NULL]"
           modified_by="[NULL]"/>
</dataset>